{
  "name": "Windows FIPS-Compliant Algorithms Enforced",
  "description": "Ensures the Windows FIPS algorithm policy is enabled (FipsAlgorithmPolicy Enabled=1), restricting the host to approved cryptographic algorithms.",
  "active": true,
  "category": "system_hardening",
  "cycle": 3600,
  "cmd_info_key": null,
  "cmd": {
    "validation": [
      {
        "command": "reg query HKLM\\SYSTEM\\CurrentControlSet\\Control\\Lsa\\FipsAlgorithmPolicy /v Enabled",
        "system": [
          "Windows"
        ],
        "distribution": []
      }
    ],
    "expect": [
      {
        "system": [
          "Windows"
        ],
        "distribution": [],
        "re": {
          "stdout": "Enabled\\s+REG_DWORD\\s+0x1"
        }
      }
    ],
    "remedy": [],
    "system": []
  },
  "parameters": [],
  "tags": [
    "std:NIST_800-53:SC-12",
    "std:NIST_800-53:SC-13",
    "std:ISO27001:A.8.24",
    "std:ISO27001:A.10.1.1",
    "std:SOC2:CC6.7",
    "std:CMMC:SC.L2-3.13.11",
    "std:PCI_DSS_4:12.3.3",
    "std:NIS2:Art21.2(h)",
    "std:DORA:Art9",
    "std:NIST_PQC:transition",
    "cat:system_hardening",
    "env:windows",
    "env:host_level",
    "risk:high",
    "priv:required"
  ]
}
