{
  "name": "Unprivileged eBPF Disabled",
  "description": "Ensures kernel.unprivileged_bpf_disabled is 1 or 2, preventing unprivileged processes from loading eBPF programs (a recurring kernel privilege-escalation vector). Ubuntu defaults to 2.\nRequired sudo rule (remedy only): allow user lea to run ONLY this exact command without a password: lea ALL=(root) NOPASSWD: /sbin/sysctl -w kernel.unprivileged_bpf_disabled=1",
  "active": true,
  "category": "kernel_security",
  "cycle": 3600,
  "cmd_info_key": null,
  "cmd": {
    "validation": [
      {
        "command": "cat /proc/sys/kernel/unprivileged_bpf_disabled",
        "system": [
          "Linux"
        ],
        "distribution": []
      }
    ],
    "expect": [
      {
        "system": [
          "Linux"
        ],
        "distribution": [],
        "re": {
          "stdout": "^[12]$"
        }
      }
    ],
    "remedy": [
      {
        "command": "sysctl -w kernel.unprivileged_bpf_disabled=1 >/dev/null && cat /proc/sys/kernel/unprivileged_bpf_disabled",
        "system": [
          "Linux"
        ],
        "distribution": []
      }
    ],
    "system": []
  },
  "parameters": [],
  "tags": [
    "std:CIS",
    "std:CIS_Controls_v8:10.5",
    "std:NIST_800-53:CM-6",
    "std:NIST_800-53:SI-7",
    "std:NIST_800-53:SI-16",
    "std:ISO27001:A.8.9",
    "std:SOC2:CC6.8",
    "std:CMMC:CM.L2-3.4.2",
    "std:PCI_DSS_4:2.2.6",
    "std:NIS2:Art21.2(e)",
    "std:DORA:Art9",
    "std:HIPAA:164.308(a)(1)(ii)(B)",
    "std:HIPAA:164.312(c)(1)",
    "std:NIST_CSF_2:DE.CM-09",
    "std:NIST_CSF_2:PR.DS-01",
    "std:NIST_CSF_2:PR.PS-01",
    "cat:kernel_security",
    "env:linux",
    "env:host_level",
    "risk:high"
  ]
}
