{
  "name": "Password Repeated Characters Limited (maxrepeat 1-3)",
  "description": "Ensures pam_pwquality rejects passwords with more than 3 identical consecutive characters (maxrepeat between 1 and 3).",
  "active": true,
  "category": "password_policy",
  "cycle": 3600,
  "cmd_info_key": null,
  "cmd": {
    "validation": [
      {
        "command": "cat /etc/security/pwquality.conf /etc/security/pwquality.conf.d/*.conf 2>/dev/null",
        "system": [
          "Linux"
        ],
        "distribution": []
      }
    ],
    "expect": [
      {
        "system": [
          "Linux"
        ],
        "distribution": [],
        "re": {
          "stdout": "(?m)^[ \\t]*maxrepeat[ \\t]*=[ \\t]*[1-3]\\b"
        },
        "not_re": {
          "stdout": "(?m)^[ \\t]*maxrepeat[ \\t]*=[ \\t]*(?:0|[4-9]|\\d{2,})\\b"
        }
      }
    ],
    "remedy": [],
    "system": []
  },
  "parameters": [],
  "tags": [
    "std:CIS",
    "std:CIS_Controls_v8:5.2",
    "std:NIST_800-53:IA-5",
    "std:ISO27001:A.5.17",
    "std:SOC2:CC6.1",
    "std:CMMC:IA.L2-3.5.7",
    "std:PCI_DSS_4:8.3.6",
    "std:NIS2:Art21.2(i)",
    "std:DORA:Art9",
    "std:HIPAA:164.308(a)(5)(ii)(D)",
    "std:HIPAA:164.312(d)",
    "std:NIST_CSF_2:PR.AA-01",
    "cat:password_policy",
    "env:linux",
    "env:host_level",
    "risk:low"
  ]
}
