{
  "name": "/var/log/audit Is a Separate Mount",
  "description": "Ensures /var/log/audit is a separate filesystem in /proc/mounts, so it can carry restrictive mount options and filling it cannot exhaust other filesystems or stop audit logging.",
  "active": true,
  "category": "system_hardening",
  "cycle": 3600,
  "cmd_info_key": null,
  "cmd": {
    "validation": [
      {
        "command": "cat /proc/mounts",
        "system": [
          "Linux"
        ],
        "distribution": []
      }
    ],
    "expect": [
      {
        "system": [
          "Linux"
        ],
        "distribution": [],
        "re": {
          "stdout": "(?m)^\\S+[ \\t]+/var/log/audit[ \\t]"
        }
      }
    ],
    "remedy": [],
    "system": []
  },
  "parameters": [],
  "tags": [
    "std:CIS",
    "std:CIS_Controls_v8:4.1",
    "std:NIST_800-53:AU-4",
    "std:NIST_800-53:CM-6",
    "std:ISO27001:A.8.9",
    "std:SOC2:CC7.1",
    "std:CMMC:CM.L2-3.4.2",
    "std:PCI_DSS_4:2.2.6",
    "std:NIS2:Art21.2(e)",
    "std:DORA:Art9",
    "std:HIPAA:164.308(a)(1)(ii)(B)",
    "std:HIPAA:164.312(b)",
    "std:NIST_CSF_2:PR.PS-01",
    "std:NIST_CSF_2:PR.PS-04",
    "cat:system_hardening",
    "env:linux",
    "env:host_level",
    "risk:medium"
  ]
}
