{
  "name": "Default Shell umask 027 or Stricter",
  "description": "Ensures system-wide shell profiles set umask 027 (or stricter) and no profile sets a weaker umask, so files created in interactive sessions are not world-readable.",
  "active": true,
  "category": "system_hardening",
  "cycle": 3600,
  "cmd_info_key": null,
  "cmd": {
    "validation": [
      {
        "command": "cat /etc/profile /etc/profile.d/*.sh /etc/bashrc /etc/bash.bashrc 2>/dev/null",
        "system": [
          "Linux"
        ],
        "distribution": []
      }
    ],
    "expect": [
      {
        "system": [
          "Linux"
        ],
        "distribution": [],
        "re": {
          "stdout": "(?m)^[ \\t]*umask[ \\t]+0?[0-7][2367]7\\b"
        },
        "not_re": {
          "stdout": "(?m)^[ \\t]*umask[ \\t]+0?[0-7](?:[0145][0-7]|[0-7][0-6])\\b"
        }
      }
    ],
    "remedy": [],
    "system": []
  },
  "parameters": [],
  "tags": [
    "std:CIS",
    "std:CIS_Controls_v8:3.3",
    "std:NIST_800-53:AC-3",
    "std:ISO27001:A.8.3",
    "std:SOC2:CC6.1",
    "std:CMMC:AC.L2-3.1.1",
    "std:PCI_DSS_4:2.2.6",
    "std:NIS2:Art21.2(i)",
    "std:DORA:Art9",
    "std:HIPAA:164.312(a)(1)",
    "std:NIST_CSF_2:PR.AA-05",
    "cat:system_hardening",
    "env:linux",
    "env:host_level",
    "risk:medium"
  ]
}
