{
  "name": "Windows User Right 'Profile Single Process' Restricted",
  "description": "Ensures the user right 'Profile Single Process' (SeProfileSingleProcessPrivilege) is granted to only the default administrative and service principals. This right can be abused to take full control of the system or bypass access controls. Allowed principals (SIDs): S-1-5-32-544; any other principal fails.\nRequired Windows permission: the LEA agent account must be allowed to run secedit /export /areas SECURITYPOLICY USER_RIGHTS (administrator rights) via a delegated run-as permission, Scheduled Task, or service configuration.",
  "active": true,
  "category": "access_control",
  "cycle": 3600,
  "cmd_info_key": null,
  "cmd": {
    "validation": [
      {
        "command": "$f = [System.IO.Path]::GetTempFileName(); secedit /export /areas SECURITYPOLICY USER_RIGHTS /cfg $f /quiet | Out-Null; Get-Content $f; Remove-Item $f -Force",
        "system": [
          "Windows"
        ],
        "distribution": []
      }
    ],
    "expect": [
      {
        "system": [
          "Windows"
        ],
        "distribution": [],
        "re": {
          "stdout": "\\[Privilege Rights\\]"
        },
        "not_re": {
          "stdout": "(?m)^SeProfileSingleProcessPrivilege[ \\t]*=[ \\t]*(?:[^,\\r\\n]*,)*(?![ \\t]*(?:\\*S\\-1\\-5\\-32\\-544)[ \\t]*(?:,|\\r?$))[^,\\r\\n]+"
        }
      }
    ],
    "remedy": [],
    "system": []
  },
  "parameters": [],
  "tags": [
    "std:CIS",
    "std:CIS_Controls_v8:5.4",
    "std:NIST_800-53:AC-6",
    "std:ISO27001:A.8.2",
    "std:SOC2:CC6.3",
    "std:CMMC:AC.L2-3.1.5",
    "std:CMMC:AC.L2-3.1.7",
    "std:PCI_DSS_4:7.2.2",
    "std:NIS2:Art21.2(i)",
    "std:DORA:Art9",
    "std:HIPAA:164.312(a)(1)",
    "std:NIST_CSF_2:PR.AA-05",
    "std:ASD_E8:restrict_admin_privileges",
    "cat:access_control",
    "env:windows",
    "env:host_level",
    "risk:low",
    "priv:required"
  ]
}
