{
  "name": "Windows CredSSP Encryption Oracle Remediation Forced",
  "description": "Ensures CredSSP only talks to updated clients and servers (AllowEncryptionOracle = 0), mitigating CVE-2018-0886.",
  "active": true,
  "category": "authentication",
  "cycle": 3600,
  "cmd_info_key": null,
  "cmd": {
    "validation": [
      {
        "command": "reg query \"HKLM\\SOFTWARE\\Microsoft\\Windows\\CurrentVersion\\Policies\\System\\CredSSP\\Parameters\" /v AllowEncryptionOracle",
        "system": [
          "Windows"
        ],
        "distribution": []
      }
    ],
    "expect": [
      {
        "system": [
          "Windows"
        ],
        "distribution": [],
        "re": {
          "stdout": "(?mi)^[ \\t]+AllowEncryptionOracle[ \\t]+REG_DWORD[ \\t]+0x(?:0)\\b"
        }
      }
    ],
    "remedy": [],
    "system": []
  },
  "parameters": [],
  "tags": [
    "std:CIS",
    "std:CIS_Controls_v8:7.3",
    "std:NIST_800-53:SI-2",
    "std:ISO27001:A.8.8",
    "std:SOC2:CC7.1",
    "std:CMMC:SI.L2-3.14.1",
    "std:PCI_DSS_4:6.3.3",
    "std:NIS2:Art21.2(e)",
    "std:DORA:Art9",
    "std:HIPAA:164.308(a)(1)(ii)(B)",
    "std:NIST_CSF_2:ID.RA-01",
    "std:NIST_CSF_2:PR.PS-02",
    "cat:authentication",
    "env:windows",
    "env:host_level",
    "risk:high"
  ]
}
